{
  "schema": "computer-use-eval-report-v1",
  "run": {
    "mode": "replay",
    "datasetId": "w1-smoke",
    "datasetVersion": "0.1.0+trace:trace-w1-smoke-0001",
    "runnerKind": "recorded",
    "runnerLabel": "recorded-evidence (not a model accuracy measurement)",
    "sourceCommit": "abc1234",
    "provider": "cpu",
    "timestamp": "2026-10-11T00:00:00Z",
    "hardware": "generic-x64"
  },
  "configuration": {
    "modelConfigurationId": "gui-actor-2b-fp16@0.1.0",
    "adapterId": "gui-actor-onnx",
    "adapterVersion": "0.1.0",
    "preprocessingRevision": "prep-v1",
    "decodingRevision": "dec-v1",
    "calibrationRevision": "cal-v1"
  },
  "cases": [
    {
      "caseId": "w1-name-box-100",
      "split": "regression",
      "fixtureHash": "0000000000000000000000000000000000000000000000000000000000000000",
      "expected": "region",
      "actual": "candidates",
      "regionHit": true,
      "status": "pass",
      "reason": "candidate inside labeled region",
      "inferenceMs": 434
    }
  ],
  "aggregate": {
    "planned": 1,
    "executed": 1,
    "passed": 1,
    "failed": 0,
    "skipped": 0,
    "regionHitRate": 1.0,
    "absenceFalseAccepts": 0,
    "latency": {
      "p50": 434.0,
      "p95": 434.0,
      "max": 434.0
    }
  },
  "qualification": {
    "missingEvidence": [],
    "producerOnly": true
  }
}
